{
  "policyKind": "valuation_basis",
  "version": 3,
  "effectiveFrom": "1970-01-01T00:00:00Z",
  "effectiveTo": null,
  "scope": {
    "tenantId": "00000000-0000-0000-0000-000000000000",
    "siteId": null,
    "unitId": null
  },
  "notes": "Version 3 recorded 2026-10-14 from the plant SME answers V1-V8 (pilot settings, finance confirms): the economic view (lost contribution on unrecovered sales plus incremental costs, V2 / V3) is the default management value (V8); lost output is lost contribution only for products with an approved demand-constrained status (V3); FX from the 'economic' rate table at the event date, a month average refused beyond 5 % deviation (V5 / V6); manual downtime lines get an hourly cost only for the hours of their evidenced events (V4). No quality disposition default: finance maps impact codes to scrap / downgrade / rework. Seeded unapproved; a finance approver (never the author) approves it (V1). Versions 1 and 2 are kept as history. scope.tenantId is a placeholder that the seeder replaces.",
  "body": {
    "defaultBasis": "economic_impact",
    "timeBasisRule": "exclusive",
    "reportingCurrencies": ["IRR", "USD"],
    "fxPolicy": "snapshot",
    "independentImpactCodeIds": [],
    "fxRateType": "economic",
    "fxDateRule": "event_date",
    "fxAverageMaxDeviation": "0.05",
    "demandRule": "demand_constrained_only",
    "qualityDispositions": {},
    "defaultQualityDisposition": null,
    "manualLineHours": true
  }
}
